{
  "schemaVersion": "1",
  "id": "enistere-default",
  "version": "1.0.0",
  "contractVersion": "1",
  "institution": { "id": "enistere", "displayName": "Enistere" },
  "selection": {
    "contexts": ["default"],
    "allowUserMode": true,
    "followSystem": true,
    "fallbackThemeId": null
  },
  "shared": {
    "spacing": { "xs": 4, "sm": 8, "md": 16, "lg": 24, "xl": 32, "xxl": 48 },
    "radius": { "xs": 0, "sm": 4, "md": 8, "lg": 12, "xl": 20, "xxl": 9999 },
    "minimumTouchTarget": 44
  },
  "modes": {
    "light": {
      "colors": {
        "background.default": "#FFFFFF", "background.muted": "#F8FAFC", "background.elevated": "#FFFFFF",
        "foreground.default": "#0F172A", "foreground.muted": "#64748B", "foreground.inverse": "#FFFFFF",
        "border.default": "#E2E8F0", "border.strong": "#CBD5E1", "border.focus": "#3B82F6",
        "action.primary": "#2563EB", "action.primaryHover": "#1D4ED8", "action.primaryPressed": "#1E40AF", "action.disabled": "#CBD5E1",
        "status.success": "#16A34A", "status.warning": "#D97706", "status.danger": "#DC2626", "status.info": "#2563EB",
        "focus.ring": "#3B82F6", "overlay": "#0F172ACC"
      }
    },
    "dark": {
      "colors": {
        "background.default": "#020617", "background.muted": "#0F172A", "background.elevated": "#1E293B",
        "foreground.default": "#F8FAFC", "foreground.muted": "#94A3B8", "foreground.inverse": "#0F172A",
        "border.default": "#334155", "border.strong": "#475569", "border.focus": "#60A5FA",
        "action.primary": "#3B82F6", "action.primaryHover": "#60A5FA", "action.primaryPressed": "#93C5FD", "action.disabled": "#334155",
        "status.success": "#22C55E", "status.warning": "#F59E0B", "status.danger": "#EF4444", "status.info": "#3B82F6",
        "focus.ring": "#60A5FA", "overlay": "#020617CC"
      }
    }
  },
  "assets": []
}
